{
  "ledger_id": "element-reconciliation-ledger.v1",
  "version": "1.0.0",
  "status": "active_seed",
  "source_base_commit": "487ffd8fb3b4d64ddf0cd44c4d8d87eb7ab6b5a8",
  "known_scope_count": 15,
  "confirmed_denominator_count": 7,
  "denominator_state": "unresolved",
  "records": [
    {
      "record_id": "EL-DIV_BLOCK",
      "record_type": "atomic",
      "element_id": "v4.div_block",
      "display_name": "Div Block",
      "evidence_state": "confirmed",
      "denominator_membership": "confirmed",
      "source_references": [
        {
          "source_type": "kernel_element_registry",
          "path": "kernel/registries/elements.core.v0.json",
          "artifact_version": "0.1.0-mvk",
          "retrieval_identity": "repository_commit:487ffd8fb3b4d64ddf0cd44c4d8d87eb7ab6b5a8",
          "content_hash": "85c3d36b204b937b964040f049cddbd94fa7c6669e8dc08773a68e4c640c9d09",
          "repository_commit": "487ffd8fb3b4d64ddf0cd44c4d8d87eb7ab6b5a8",
          "repository_blob_sha": "37f5c4ba654f0a4358b5f2cb472257c69352c2ec",
          "provenance_classification": "existing_repository_contract",
          "verification_mode": "local_file",
          "json_pointer": "/elements/0"
        },
        {
          "source_type": "kernel_decision_card_registry",
          "path": "kernel/decision-cards/elements.core.v0.json",
          "artifact_version": "0.6.1-doc-coverage-root-repair",
          "retrieval_identity": "repository_commit:487ffd8fb3b4d64ddf0cd44c4d8d87eb7ab6b5a8",
          "content_hash": "61f4fb2e620ac1f295a27c6f05172ba3436f3b58b5ef30d6c3b54e519f668b0a",
          "repository_commit": "487ffd8fb3b4d64ddf0cd44c4d8d87eb7ab6b5a8",
          "repository_blob_sha": "d62a8a1fa1a23ca6d091d468092ead8635d3f979",
          "provenance_classification": "existing_repository_contract",
          "verification_mode": "local_file",
          "json_pointer": "/cards/0"
        },
        {
          "source_type": "official_source_manifest",
          "path": "kernel/official-sources/elementor-v4-source-manifest.v0.json",
          "artifact_version": "0.6.0-doc-coverage-repair",
          "retrieval_identity": "official_sources_verified_at:2026-07-08T00:00:00Z",
          "content_hash": "fdcc7ce30fe4ee07c80816ebaa7a4ef35d91de39feb33877d1ddb2dca73197c0",
          "repository_commit": "487ffd8fb3b4d64ddf0cd44c4d8d87eb7ab6b5a8",
          "repository_blob_sha": "b17d7cb2c0828c6c4b485cd9ac19f054ad102a6f",
          "provenance_classification": "verified_current_official_fact",
          "verification_mode": "local_file",
          "json_pointer": "/sources"
        }
      ],
      "element_obligations": {
        "applicable_decision_questions": [
          {
            "obligation_id": "OB-DQ-DIV_BLOCK-01",
            "status": "partial",
            "critical": true,
            "evidence_refs": [
              "planning/coverage/decision-question-catalog.v1.json#DQ-DIV_BLOCK-01"
            ],
            "not_applicable_reason": null
          },
          {
            "obligation_id": "OB-DQ-DIV_BLOCK-02",
            "status": "partial",
            "critical": true,
            "evidence_refs": [
              "planning/coverage/decision-question-catalog.v1.json#DQ-DIV_BLOCK-02"
            ],
            "not_applicable_reason": null
          },
          {
            "obligation_id": "OB-DQ-DIV_BLOCK-03",
            "status": "partial",
            "critical": true,
            "evidence_refs": [
              "planning/coverage/decision-question-catalog.v1.json#DQ-DIV_BLOCK-03"
            ],
            "not_applicable_reason": null
          }
        ],
        "applicable_p0_families": [
          {
            "obligation_id": "OB-P0-LAYOUT_STRUCTURE",
            "status": "partial",
            "critical": true,
            "evidence_refs": [
              "kernel/decision-governance/p0-decision-matrices.v0.json#p0.matrix.layout_structure.v0"
            ],
            "not_applicable_reason": null
          }
        ],
        "required_safety_gates": [
          {
            "obligation_id": "OB-SAFETY-STRUCTURAL_WRAPPER_AND_NESTED_LINK_SAFETY",
            "status": "partial",
            "critical": true,
            "evidence_refs": [
              "kernel/decision-cards/elements.core.v0.json#v4.div_block"
            ],
            "not_applicable_reason": null
          }
        ],
        "required_runtime_checks": [
          {
            "obligation_id": "OB-RUNTIME-DIV_BLOCK",
            "status": "unresolved",
            "critical": false,
            "evidence_refs": [],
            "not_applicable_reason": null
          }
        ],
        "required_consumer_proofs": [
          {
            "obligation_id": "OB-CONSUMER-DIV_BLOCK",
            "status": "unresolved",
            "critical": true,
            "evidence_refs": [],
            "not_applicable_reason": null
          }
        ]
      },
      "resolution_state": "partial",
      "known_limitations": [
        "Repository and official-document identity are confirmed; end-to-end runtime and consumer obligations remain open.",
        "No target-project availability or production readiness is claimed."
      ],
      "duplicate_of": null,
      "superseded_by": null
    },
    {
      "record_id": "EL-FLEXBOX",
      "record_type": "atomic",
      "element_id": "v4.flexbox",
      "display_name": "Flexbox",
      "evidence_state": "confirmed",
      "denominator_membership": "confirmed",
      "source_references": [
        {
          "source_type": "kernel_element_registry",
          "path": "kernel/registries/elements.core.v0.json",
          "artifact_version": "0.1.0-mvk",
          "retrieval_identity": "repository_commit:487ffd8fb3b4d64ddf0cd44c4d8d87eb7ab6b5a8",
          "content_hash": "85c3d36b204b937b964040f049cddbd94fa7c6669e8dc08773a68e4c640c9d09",
          "repository_commit": "487ffd8fb3b4d64ddf0cd44c4d8d87eb7ab6b5a8",
          "repository_blob_sha": "37f5c4ba654f0a4358b5f2cb472257c69352c2ec",
          "provenance_classification": "existing_repository_contract",
          "verification_mode": "local_file",
          "json_pointer": "/elements/1"
        },
        {
          "source_type": "kernel_decision_card_registry",
          "path": "kernel/decision-cards/elements.core.v0.json",
          "artifact_version": "0.6.1-doc-coverage-root-repair",
          "retrieval_identity": "repository_commit:487ffd8fb3b4d64ddf0cd44c4d8d87eb7ab6b5a8",
          "content_hash": "61f4fb2e620ac1f295a27c6f05172ba3436f3b58b5ef30d6c3b54e519f668b0a",
          "repository_commit": "487ffd8fb3b4d64ddf0cd44c4d8d87eb7ab6b5a8",
          "repository_blob_sha": "d62a8a1fa1a23ca6d091d468092ead8635d3f979",
          "provenance_classification": "existing_repository_contract",
          "verification_mode": "local_file",
          "json_pointer": "/cards/1"
        },
        {
          "source_type": "official_source_manifest",
          "path": "kernel/official-sources/elementor-v4-source-manifest.v0.json",
          "artifact_version": "0.6.0-doc-coverage-repair",
          "retrieval_identity": "official_sources_verified_at:2026-07-08T00:00:00Z",
          "content_hash": "fdcc7ce30fe4ee07c80816ebaa7a4ef35d91de39feb33877d1ddb2dca73197c0",
          "repository_commit": "487ffd8fb3b4d64ddf0cd44c4d8d87eb7ab6b5a8",
          "repository_blob_sha": "b17d7cb2c0828c6c4b485cd9ac19f054ad102a6f",
          "provenance_classification": "verified_current_official_fact",
          "verification_mode": "local_file",
          "json_pointer": "/sources"
        }
      ],
      "element_obligations": {
        "applicable_decision_questions": [
          {
            "obligation_id": "OB-DQ-FLEXBOX-01",
            "status": "partial",
            "critical": true,
            "evidence_refs": [
              "planning/coverage/decision-question-catalog.v1.json#DQ-FLEXBOX-01"
            ],
            "not_applicable_reason": null
          },
          {
            "obligation_id": "OB-DQ-FLEXBOX-02",
            "status": "partial",
            "critical": true,
            "evidence_refs": [
              "planning/coverage/decision-question-catalog.v1.json#DQ-FLEXBOX-02"
            ],
            "not_applicable_reason": null
          },
          {
            "obligation_id": "OB-DQ-FLEXBOX-03",
            "status": "partial",
            "critical": true,
            "evidence_refs": [
              "planning/coverage/decision-question-catalog.v1.json#DQ-FLEXBOX-03"
            ],
            "not_applicable_reason": null
          }
        ],
        "applicable_p0_families": [
          {
            "obligation_id": "OB-P0-LAYOUT_STRUCTURE",
            "status": "partial",
            "critical": true,
            "evidence_refs": [
              "kernel/decision-governance/p0-decision-matrices.v0.json#p0.matrix.layout_structure.v0"
            ],
            "not_applicable_reason": null
          }
        ],
        "required_safety_gates": [
          {
            "obligation_id": "OB-SAFETY-AXIS_AND_NESTED_LINK_SAFETY",
            "status": "partial",
            "critical": true,
            "evidence_refs": [
              "kernel/decision-cards/elements.core.v0.json#v4.flexbox"
            ],
            "not_applicable_reason": null
          }
        ],
        "required_runtime_checks": [
          {
            "obligation_id": "OB-RUNTIME-FLEXBOX",
            "status": "unresolved",
            "critical": false,
            "evidence_refs": [],
            "not_applicable_reason": null
          }
        ],
        "required_consumer_proofs": [
          {
            "obligation_id": "OB-CONSUMER-FLEXBOX",
            "status": "unresolved",
            "critical": true,
            "evidence_refs": [],
            "not_applicable_reason": null
          }
        ]
      },
      "resolution_state": "partial",
      "known_limitations": [